{
  "schema_version": "0.1.0",
  "kind": "screens_part",
  "path_id": "data_analyst",
  "batch_id": "final_batch_003_da_chunk",
  "tiles": [
    {
      "tile_id": "tile_stats_correlation",
      "title": "Correlation Between Two Variables",
      "summary": "Read a correlation coefficient's sign and magnitude to describe the direction and strength of a linear relationship, rank pairwise correlations by magnitude, and restate correlational findings as associations rather than causal claims.",
      "steps": [
        {
          "step_id": "tile_stats_correlation.s01",
          "type": "explainer",
          "concept_ids": [
            "stats.correlation"
          ],
          "eyebrow": "Correlation",
          "title": "Does Distance Predict Delivery Time?",
          "lede": "When two numeric columns move together, correlation gives you a single number that captures how strongly — and in which direction — they're linked.",
          "blocks": [
            {
              "type": "prose",
              "block_id": "tile_stats_correlation.s01.p1",
              "role": "intro",
              "text": "QuickShip records two numbers for every delivery: distance in kilometres and delivery time in minutes. Do farther orders tend to take longer? Correlation answers that question with a single value that always sits between −1 and +1.",
              "lineage": {
                "concept_ids": [
                  "stats.correlation"
                ],
                "teaching_block_ids": [
                  "stats.correlation#tb1"
                ],
                "fact_ids": [
                  "stats.correlation#f1"
                ]
              }
            },
            {
              "type": "chart",
              "block_id": "tile_stats_correlation.s01.chart1",
              "chart_kind": "scatter",
              "asset_ref": {
                "asset_id": "ds_delivery_orders_extended",
                "variant_id": null,
                "columns": null
              },
              "title": "Distance vs. Delivery Time: Positive Correlation",
              "alt_text": "Scatter plot showing delivery orders. Points trend upward from left to right, indicating that as distance increases, delivery time also tends to increase — a positive correlation.",
              "encoding": {
                "x": {
                  "field": "distance_km",
                  "type": "quantitative",
                  "title": "Distance (km)"
                },
                "y": {
                  "field": "delivery_minutes",
                  "type": "quantitative",
                  "title": "Delivery Time (minutes)"
                }
              },
              "lineage": {
                "concept_ids": [
                  "stats.correlation"
                ],
                "teaching_block_ids": [
                  "stats.correlation#tb2",
                  "stats.correlation#tb3"
                ],
                "fact_ids": [
                  "stats.correlation#f1",
                  "stats.correlation#f2"
                ],
                "anchors": [
                  "stats.correlation#visual"
                ]
              }
            },
            {
              "type": "prose",
              "block_id": "tile_stats_correlation.s01.p2",
              "role": "definition",
              "text": "Correlation, which always takes values between −1 and +1, describes the strength of the linear relationship between two numeric variables. In a positive association, higher values of one variable tend to go with higher values of the other. In a negative association, higher values of one variable tend to go with lower values of the other.",
              "lineage": {
                "concept_ids": [
                  "stats.correlation"
                ],
                "teaching_block_ids": [
                  "stats.correlation#tb2",
                  "stats.correlation#tb3"
                ],
                "fact_ids": [
                  "stats.correlation#f1",
                  "stats.correlation#f2"
                ]
              }
            }
          ],
          "reward": {
            "gems": 5
          },
          "lineage": {
            "concept_ids": [
              "stats.correlation"
            ],
            "teaching_block_ids": [
              "stats.correlation#tb1",
              "stats.correlation#tb2",
              "stats.correlation#tb3"
            ],
            "fact_ids": [
              "stats.correlation#f1",
              "stats.correlation#f2"
            ],
            "anchors": [
              "stats.correlation#visual"
            ]
          }
        },
        {
          "step_id": "tile_stats_correlation.s02",
          "type": "video",
          "concept_ids": [
            "stats.correlation"
          ],
          "eyebrow": "Watch",
          "title": "Scatter Patterns and the Correlation Coefficient",
          "lede": "See how the shape of a scatter plot maps to values between −1 and +1.",
          "blocks": [
            {
              "type": "media_group",
              "block_id": "tile_stats_correlation.s02.mg1",
              "segment_ids": [
                "seg_stats.correlation_6fUYt1alA1U_331_568"
              ]
            }
          ],
          "reward": {
            "gems": 3
          },
          "lineage": {
            "concept_ids": [
              "stats.correlation"
            ],
            "teaching_block_ids": [],
            "fact_ids": [
              "stats.correlation#f1",
              "stats.correlation#f2",
              "stats.correlation#f3"
            ],
            "segment_ids": [
              "seg_stats.correlation_6fUYt1alA1U_331_568"
            ]
          }
        },
        {
          "step_id": "tile_stats_correlation.s03",
          "type": "explainer",
          "concept_ids": [
            "stats.correlation"
          ],
          "eyebrow": "Strength and Limits",
          "title": "Reading Strength — and One Important Limit",
          "lede": "Knowing how close a value sits to −1, 0, or +1 tells you the strength. But correlation only measures straight-line relationships.",
          "blocks": [
            {
              "type": "prose",
              "block_id": "tile_stats_correlation.s03.p1",
              "role": "example",
              "text": "A correlation near +1 indicates a strong positive linear relationship; near −1, a strong negative one; near 0, little or no linear relationship. In the QuickShip data, distance and delivery time come out to 0.82 — close to +1, so farther deliveries tend to take longer.",
              "lineage": {
                "concept_ids": [
                  "stats.correlation"
                ],
                "teaching_block_ids": [
                  "stats.correlation#tb4"
                ],
                "fact_ids": [
                  "stats.correlation#f3"
                ]
              }
            },
            {
              "type": "prose",
              "block_id": "tile_stats_correlation.s03.p2",
              "role": "misconception",
              "text": "Correlation quantifies the strength of a linear relationship only. A nonlinear relationship can be strong even when its correlation value looks weak — so a value near 0 doesn't automatically mean the two variables are unrelated; it may mean their relationship isn't a straight-line one.",
              "lineage": {
                "concept_ids": [
                  "stats.correlation"
                ],
                "teaching_block_ids": [
                  "stats.correlation#tb5"
                ],
                "fact_ids": [
                  "stats.correlation#m1"
                ]
              }
            }
          ],
          "reward": {
            "gems": 5
          },
          "lineage": {
            "concept_ids": [
              "stats.correlation"
            ],
            "teaching_block_ids": [
              "stats.correlation#tb4",
              "stats.correlation#tb5"
            ],
            "fact_ids": [
              "stats.correlation#f3",
              "stats.correlation#m1"
            ]
          }
        },
        {
          "step_id": "tile_stats_correlation.s04",
          "type": "check",
          "concept_ids": [
            "stats.correlation"
          ],
          "eyebrow": "Quick Check",
          "title": "Positive or Negative?",
          "lede": "Test your reading of correlation direction.",
          "reward": {
            "gems": 5,
            "first_try_bonus": 3
          },
          "lineage": {
            "concept_ids": [
              "stats.correlation"
            ],
            "teaching_block_ids": [],
            "fact_ids": [
              "stats.correlation#f2"
            ],
            "anchors": [
              "stats.correlation#assessment:distinguish_positive_from_negative_association"
            ]
          }
        },
        {
          "step_id": "tile_stats_correlation.s05",
          "type": "check",
          "concept_ids": [
            "stats.correlation"
          ],
          "eyebrow": "Quick Check",
          "title": "What Correlation Can't Tell You",
          "lede": "Confirm you know the linear-only limit of correlation.",
          "reward": {
            "gems": 5,
            "first_try_bonus": 3
          },
          "lineage": {
            "concept_ids": [
              "stats.correlation"
            ],
            "teaching_block_ids": [],
            "fact_ids": [
              "stats.correlation#m1"
            ],
            "anchors": [
              "stats.correlation#assessment:recognize_linear_only_limit"
            ]
          }
        },
        {
          "step_id": "tile_stats_correlation.s06",
          "type": "hands_on",
          "concept_ids": [
            "stats.correlation"
          ],
          "eyebrow": "Practice",